smartctl 6.5 2016-01-24 r4214 [x86_64-linux-4.4.0-31-generic] (local build)
Copyright (C) 2002-16, Bruce Allen, Christian Franke, www.smartmontools.org

=== START OF INFORMATION SECTION ===
Model Family:     Seagate Barracuda 7200.10
Device Model:     ST3160815AS
Serial Number:    9RA2BG8T
Firmware Version: 3.AAD
User Capacity:    160,041,885,696 bytes [160 GB]
Sector Size:      512 bytes logical/physical
Device is:        In smartctl database [for details use: -P show]
ATA Version is:   ATA/ATAPI-7 (minor revision not indicated)
Local Time is:    Fri Dec 23 20:11:16 2016 UTC
SMART support is: Available - device has SMART capability.
SMART support is: Enabled

=== START OF READ SMART DATA SECTION ===
SMART overall-health self-assessment test result: PASSED

General SMART Values:
Offline data collection status:  (0x82)	Offline data collection activity
					was completed without error.
					Auto Offline Data Collection: Enabled.
Self-test execution status:      (   0)	The previous self-test routine completed
					without error or no self-test has ever 
					been run.
Total time to complete Offline 
data collection: 		(  430) seconds.
Offline data collection
capabilities: 			 (0x5b) SMART execute Offline immediate.
					Auto Offline data collection on/off support.
					Suspend Offline collection upon new
					command.
					Offline surface scan supported.
					Self-test supported.
					No Conveyance Self-test supported.
					Selective Self-test supported.
SMART capabilities:            (0x0003)	Saves SMART data before entering
					power-saving mode.
					Supports SMART auto save timer.
Error logging capability:        (0x01)	Error logging supported.
					General Purpose Logging supported.
Short self-test routine 
recommended polling time: 	 (   1) minutes.
Extended self-test routine
recommended polling time: 	 (  54) minutes.

SMART Attributes Data Structure revision number: 10
Vendor Specific SMART Attributes with Thresholds:
ID# ATTRIBUTE_NAME          FLAG     VALUE WORST THRESH TYPE      UPDATED  WHEN_FAILED RAW_VALUE
  1 Raw_Read_Error_Rate     0x000f   116   099   006    Pre-fail  Always       -       111355641
  3 Spin_Up_Time            0x0003   098   097   000    Pre-fail  Always       -       0
  4 Start_Stop_Count        0x0032   095   095   020    Old_age   Always       -       5167
  5 Reallocated_Sector_Ct   0x0033   100   100   036    Pre-fail  Always       -       0
  7 Seek_Error_Rate         0x000f   088   060   030    Pre-fail  Always       -       772808524
  9 Power_On_Hours          0x0032   066   066   000    Old_age   Always       -       30346
 10 Spin_Retry_Count        0x0013   100   099   097    Pre-fail  Always       -       0
 12 Power_Cycle_Count       0x0032   095   095   020    Old_age   Always       -       5158
187 Reported_Uncorrect      0x0032   100   100   000    Old_age   Always       -       0
189 High_Fly_Writes         0x003a   096   096   000    Old_age   Always       -       4
190 Airflow_Temperature_Cel 0x0022   056   048   045    Old_age   Always       -       44 (Min/Max 43/52)
194 Temperature_Celsius     0x0022   044   052   000    Old_age   Always       -       44 (0 20 0 0 0)
195 Hardware_ECC_Recovered  0x001a   053   046   000    Old_age   Always       -       235535179
197 Current_Pending_Sector  0x0012   100   100   000    Old_age   Always       -       0
198 Offline_Uncorrectable   0x0010   100   100   000    Old_age   Offline      -       0
199 UDMA_CRC_Error_Count    0x003e   200   200   000    Old_age   Always       -       0
200 Multi_Zone_Error_Rate   0x0000   100   253   000    Old_age   Offline      -       0
202 Data_Address_Mark_Errs  0x0032   100   253   000    Old_age   Always       -       0

SMART Error Log Version: 1
No Errors Logged

SMART Self-test log structure revision number 1
Num  Test_Description    Status                  Remaining  LifeTime(hours)  LBA_of_first_error
# 1  Extended offline    Completed without error       00%     30344         -
# 2  Short offline       Completed without error       00%     30344         -

SMART Selective self-test log data structure revision number 1
 SPAN  MIN_LBA  MAX_LBA  CURRENT_TEST_STATUS
    1        0        0  Not_testing
    2        0        0  Not_testing
    3        0        0  Not_testing
    4        0        0  Not_testing
    5        0        0  Not_testing
Selective self-test flags (0x0):
  After scanning selected spans, do NOT read-scan remainder of disk.
If Selective self-test is pending on power-up, resume after 0 minute delay.
